{
  "webhook_outbox_event_presentment_contract_version": 1,
  "outbox_event_id": "019d7b92-1aa0-7a7f-b61c-962c0f4bfe13",
  "tenant_reference": "urn:cwl:tenant_001",
  "event_type_code": "spend_budget.over",
  "source_id": "019d7b92-1aa0-7a7f-b61c-962c0f4bfe03",
  "payload_hash": "sha256:bbbbbbbbbbbbbbbbbbbbbbbbbbbbbbbbbbbbbbbbbbbbbbbbbbbbbbbbbbbbbbbb",
  "occurred_at": "2026-08-18T15:00:00Z",
  "enqueued_at": "2026-08-18T15:00:00Z",
  "delivery_status": "pending",
  "attempted_delivery_count": 0,
  "next_operator_action": "run_deliveries"
}
